"view_history","rt","trialid","trial_type","trial_index","time_elapsed","internal_node_id","stimulus","responses"
"[{""page_index"":0,""viewing_time"":2795}]","2796","Instructions","instructions","0","2801","0.0-0.0","",""
"","18362","AIM_01","survey-multi-choice-vertical","1","21192","0.0-1.0","{""Q0"":""¿Cuál es el nivel educacional alcanzado (último año aprobado) por el principal sostenedor del hogar?""}","{""Q0"":"" Instituto técnico (CFT) o instituto profesional completo (carreras de 1 a 3 años); hasta suboficial de FFAA y Carabineros.""}"
"","32157","AIM_02","survey-multi-choice-vertical","2","53369","0.0-2.0","{""Q0"":""¿Cuál de las siguientes ocupaciones corresponde al trabajo del principal sostenedor del hogar? [Si el principal sostenedor del hogar está cesante o es jubilado, debe ser la última ocupación remunerada que tuvo. Si el principal sostenedor tiene más de 1 trabajo, debe registrarse el de mayor ingreso.]""}","{""Q0"":"" Técnicos y profesionales de nivel medio (incluye hasta suboficiales FFAA y Carabineros).""}"
"","8858","AIM_03","survey-text","3","62242","0.0-3.0","{""Q0"":""Ahora, hablando de su hogar: Incluyéndose usted, ¿cuántas personas viven en su hogar en la actualidad? No considere el servicio doméstico, aunque sea puertas adentro.""}","{""Q0"":""4""}"
"","9118","AIM_07","survey-multi-choice-vertical","4","71380","0.0-7.0-0.0","{""Q0"":""Por favor, piense en ingreso total de su hogar en un mes promedio, considerando el aporte de todos sus miembros y otros ingresos adicionales como rentas de propiedades, jubilaciones o pensiones. ¿en cuál de estos tramos está el ingreso total mensual de su hogar?""}","{""Q0"":"" 547 mil – 953 mil""}"
