"view_history","rt","trialid","trial_type","trial_index","time_elapsed","internal_node_id","stimulus","responses"
"[{""page_index"":0,""viewing_time"":4112}]","4113","Instructions","instructions","0","4115","0.0-0.0","",""
"","50983","AIM_01","survey-multi-choice-vertical","1","55103","0.0-1.0","{""Q0"":""¿Cuál es el nivel educacional alcanzado (último año aprobado) por el principal sostenedor del hogar?""}","{""Q0"":"" Media científico humanista o media técnico profesional completa; humanidades completas.""}"
"","32263","AIM_02","survey-multi-choice-vertical","2","87371","0.0-2.0","{""Q0"":""¿Cuál de las siguientes ocupaciones corresponde al trabajo del principal sostenedor del hogar? [Si el principal sostenedor del hogar está cesante o es jubilado, debe ser la última ocupación remunerada que tuvo. Si el principal sostenedor tiene más de 1 trabajo, debe registrarse el de mayor ingreso.]""}","{""Q0"":"" Agricultores y trabajadores calificados agropecuarios y pesqueros.""}"
"","71498","AIM_03","survey-text","3","158875","0.0-3.0","{""Q0"":""Ahora, hablando de su hogar: Incluyéndose usted, ¿cuántas personas viven en su hogar en la actualidad? No considere el servicio doméstico, aunque sea puertas adentro.""}","{""Q0"":""7""}"
"","18716","AIM_10","survey-multi-choice-vertical","4","177596","0.0-10.0-0.0","{""Q0"":""Por favor, piense en ingreso total de su hogar en un mes promedio, considerando el aporte de todos sus miembros y otros ingresos adicionales como rentas de propiedades, jubilaciones o pensiones. ¿en cuál de estos tramos está el ingreso total mensual de su hogar?""}","{""Q0"":"" Menos de 464 mil""}"
