"success","procedure","trial_type","trial_index","time_elapsed","internal_node_id","view_history","rt","trialid","stimulus","responses"
"true","AIM","fullscreen","15","85032","0.0-15.0-0.0","","","","",""
"","AIM","instructions","16","86866","0.0-16.0","[{""page_index"":0,""viewing_time"":1832}]","1832","Instructions","",""
"","AIM","survey-multi-choice-vertical","17","104668","0.0-17.0","","17791","AIM_01","{""Q0"":""¿Cuál es el nivel educacional alcanzado (último año aprobado) por el principal sostenedor del hogar?""}","{""Q0"":"" Universitaria completa (carreras de 4 o más años); oficial de FFAA y Carabineros.""}"
"","AIM","survey-multi-choice-vertical","18","140714","0.0-18.0","","36039","AIM_02","{""Q0"":""¿Cuál de las siguientes ocupaciones corresponde al trabajo del principal sostenedor del hogar? [Si el principal sostenedor del hogar está cesante o es jubilado, debe ser la última ocupación remunerada que tuvo. Si el principal sostenedor tiene más de 1 trabajo, debe registrarse el de mayor ingreso.]""}","{""Q0"":"" Alto ejecutivo (gerente general o gerente de área o sector) de empresa privadas o pública- Director o dueño de grandes empresa- Alto directivo del poder ejecutivo, de los cuerpos legislativos y la administración pública (incluye oficiales de FFAA y Carabineros).""}"
"","AIM","survey-text","19","147830","0.0-19.0","","7099","AIM_03","{""Q0"":""Ahora, hablando de su hogar: Incluyéndose usted, ¿cuántas personas viven en su hogar en la actualidad? No considere el servicio doméstico, aunque sea puertas adentro.""}","{""Q0"":""5""}"
"","AIM","survey-multi-choice-vertical","20","163096","0.0-24.0-0.0","","15257","AIM_08","{""Q0"":""Por favor, piense en ingreso total de su hogar en un mes promedio, considerando el aporte de todos sus miembros y otros ingresos adicionales como rentas de propiedades, jubilaciones o pensiones. ¿en cuál de estos tramos está el ingreso total mensual de su hogar?""}","{""Q0"":"" NS/NR""}"
