"success","procedure","trial_type","trial_index","time_elapsed","internal_node_id","view_history","rt","trialid","stimulus","responses"
"true","AIM","fullscreen","16","75057","0.0-16.0-0.0","","","","",""
"","AIM","instructions","17","76934","0.0-17.0","[{""page_index"":0,""viewing_time"":1874}]","1875","Instructions","",""
"","AIM","survey-multi-choice-vertical","18","99528","0.0-18.0","","22578","AIM_01","{""Q0"":""¿Cuál es el nivel educacional alcanzado (último año aprobado) por el principal sostenedor del hogar?""}","{""Q0"":"" Universitaria completa (carreras de 4 o más años); oficial de FFAA y Carabineros.""}"
"","AIM","survey-multi-choice-vertical","19","114609","0.0-19.0","","15065","AIM_02","{""Q0"":""¿Cuál de las siguientes ocupaciones corresponde al trabajo del principal sostenedor del hogar? [Si el principal sostenedor del hogar está cesante o es jubilado, debe ser la última ocupación remunerada que tuvo. Si el principal sostenedor tiene más de 1 trabajo, debe registrarse el de mayor ingreso.]""}","{""Q0"":"" Alto ejecutivo (gerente general o gerente de área o sector) de empresa privadas o pública- Director o dueño de grandes empresa- Alto directivo del poder ejecutivo, de los cuerpos legislativos y la administración pública (incluye oficiales de FFAA y Carabineros).""}"
"","AIM","survey-text","20","123980","0.0-20.0","","9353","AIM_03","{""Q0"":""Ahora, hablando de su hogar: Incluyéndose usted, ¿cuántas personas viven en su hogar en la actualidad? No considere el servicio doméstico, aunque sea puertas adentro.""}","{""Q0"":""4""}"
"","AIM","survey-multi-choice-vertical","21","132224","0.0-24.0-0.0","","8231","AIM_07","{""Q0"":""Por favor, piense en ingreso total de su hogar en un mes promedio, considerando el aporte de todos sus miembros y otros ingresos adicionales como rentas de propiedades, jubilaciones o pensiones. ¿en cuál de estos tramos está el ingreso total mensual de su hogar?""}","{""Q0"":"" 2.900.000 – 5.057.000""}"
