"view_history","rt","trialid","procedure","trial_type","trial_index","time_elapsed","internal_node_id","stimulus","responses"
"[{""page_index"":0,""viewing_time"":3263}]","3263","Instructions","AIM","instructions","15","128347","0.0-17.0","",""
"","35002","AIM_01","AIM","survey-multi-choice-vertical","16","163356","0.0-18.0","{""Q0"":""¿Cuál es el nivel educacional alcanzado (último año aprobado) por el principal sostenedor del hogar?""}","{""Q0"":"" Universitaria completa (carreras de 4 o más años); oficial de FFAA y Carabineros.""}"
"","30444","AIM_02","AIM","survey-multi-choice-vertical","17","193807","0.0-19.0","{""Q0"":""¿Cuál de las siguientes ocupaciones corresponde al trabajo del principal sostenedor del hogar? [Si el principal sostenedor del hogar está cesante o es jubilado, debe ser la última ocupación remunerada que tuvo. Si el principal sostenedor tiene más de 1 trabajo, debe registrarse el de mayor ingreso.]""}","{""Q0"":"" Alto ejecutivo (gerente general o gerente de área o sector) de empresa privadas o pública- Director o dueño de grandes empresa- Alto directivo del poder ejecutivo, de los cuerpos legislativos y la administración pública (incluye oficiales de FFAA y Carabineros).""}"
"","8677","AIM_03","AIM","survey-text","18","202489","0.0-20.0","{""Q0"":""Ahora, hablando de su hogar: Incluyéndose usted, ¿cuántas personas viven en su hogar en la actualidad? No considere el servicio doméstico, aunque sea puertas adentro.""}","{""Q0"":""7""}"
"","25843","AIM_10","AIM","survey-multi-choice-vertical","19","228335","0.0-27.0-0.0","{""Q0"":""Por favor, piense en ingreso total de su hogar en un mes promedio, considerando el aporte de todos sus miembros y otros ingresos adicionales como rentas de propiedades, jubilaciones o pensiones. ¿en cuál de estos tramos está el ingreso total mensual de su hogar?""}","{""Q0"":"" Más de 7.482.000""}"
