"view_history","rt","trialid","trial_type","trial_index","time_elapsed","internal_node_id","stimulus","responses"
"[{""page_index"":0,""viewing_time"":3885}]","3885","Instructions","instructions","0","3887","0.0-0.0","",""
"","41744","AIM_01","survey-multi-choice-vertical","1","45642","0.0-1.0","{""Q0"":""¿Cuál es el nivel educacional alcanzado (último año aprobado) por el principal sostenedor del hogar?""}","{""Q0"":"" Media científico humanista o media técnico profesional completa; humanidades completas.""}"
"","59920","AIM_02","survey-multi-choice-vertical","2","105574","0.0-2.0","{""Q0"":""¿Cuál de las siguientes ocupaciones corresponde al trabajo del principal sostenedor del hogar? [Si el principal sostenedor del hogar está cesante o es jubilado, debe ser la última ocupación remunerada que tuvo. Si el principal sostenedor tiene más de 1 trabajo, debe registrarse el de mayor ingreso.]""}","{""Q0"":"" Empleados de oficina públicos y privados.""}"
"","9406","AIM_03","survey-text","3","114990","0.0-3.0","{""Q0"":""Ahora, hablando de su hogar: Incluyéndose usted, ¿cuántas personas viven en su hogar en la actualidad? No considere el servicio doméstico, aunque sea puertas adentro.""}","{""Q0"":""2""}"
"","12991","AIM_05","survey-multi-choice-vertical","4","127989","0.0-5.0-0.0","{""Q0"":""Por favor, piense en ingreso total de su hogar en un mes promedio, considerando el aporte de todos sus miembros y otros ingresos adicionales como rentas de propiedades, jubilaciones o pensiones. ¿en cuál de estos tramos está el ingreso total mensual de su hogar?""}","{""Q0"":"" 194 mil – 336 mil""}"
