"success","trial_type","trial_index","time_elapsed","internal_node_id","view_history","rt","trialid","stimulus","responses"
"true","fullscreen","0","20517","0.0-0.0","","","","",""
"","instructions","1","26994","0.0-1.0","[{""page_index"":0,""viewing_time"":6471}]","6473","Instructions","",""
"","survey-multi-choice-vertical","2","46059","0.0-2.0","","19043","AIM_01","{""Q0"":""¿Cuál es el nivel educacional alcanzado (último año aprobado) por el principal sostenedor del hogar?""}","{""Q0"":"" Instituto técnico (CFT) o instituto profesional completo (carreras de 1 a 3 años); hasta suboficial de FFAA y Carabineros.""}"
"","survey-multi-choice-vertical","3","122006","0.0-3.0","","75925","AIM_02","{""Q0"":""¿Cuál de las siguientes ocupaciones corresponde al trabajo del principal sostenedor del hogar? [Si el principal sostenedor del hogar está cesante o es jubilado, debe ser la última ocupación remunerada que tuvo. Si el principal sostenedor tiene más de 1 trabajo, debe registrarse el de mayor ingreso.]""}","{""Q0"":"" Técnicos y profesionales de nivel medio (incluye hasta suboficiales FFAA y Carabineros).""}"
"","survey-text","4","139009","0.0-4.0","","16988","AIM_03","{""Q0"":""Ahora, hablando de su hogar: Incluyéndose usted, ¿cuántas personas viven en su hogar en la actualidad? No considere el servicio doméstico, aunque sea puertas adentro.""}","{""Q0"":""4""}"
"","survey-multi-choice-vertical","5","174551","0.0-8.0-0.0","","35524","AIM_07","{""Q0"":""Por favor, piense en ingreso total de su hogar en un mes promedio, considerando el aporte de todos sus miembros y otros ingresos adicionales como rentas de propiedades, jubilaciones o pensiones. ¿en cuál de estos tramos está el ingreso total mensual de su hogar?""}","{""Q0"":"" 547 mil – 953 mil""}"
