"view_history","rt","trialid","trial_type","trial_index","time_elapsed","internal_node_id","stimulus","responses"
"[{""page_index"":0,""viewing_time"":2935}]","2936","Instructions","instructions","0","2937","0.0-0.0","",""
"","12287","AIM_01","survey-multi-choice-vertical","1","15229","0.0-1.0","{""Q0"":""¿Cuál es el nivel educacional alcanzado (último año aprobado) por el principal sostenedor del hogar?""}","{""Q0"":"" Universitaria incompleta (carreras de 4 o más años).""}"
"","27975","AIM_02","survey-multi-choice-vertical","2","43209","0.0-2.0","{""Q0"":""¿Cuál de las siguientes ocupaciones corresponde al trabajo del principal sostenedor del hogar? [Si el principal sostenedor del hogar está cesante o es jubilado, debe ser la última ocupación remunerada que tuvo. Si el principal sostenedor tiene más de 1 trabajo, debe registrarse el de mayor ingreso.]""}","{""Q0"":"" Profesionales, científicos e intelectuales.""}"
"","9887","AIM_03","survey-text","3","53103","0.0-3.0","{""Q0"":""Ahora, hablando de su hogar: Incluyéndose usted, ¿cuántas personas viven en su hogar en la actualidad? No considere el servicio doméstico, aunque sea puertas adentro.""}","{""Q0"":""4""}"
"","10485","AIM_07","survey-multi-choice-vertical","4","63591","0.0-7.0-0.0","{""Q0"":""Por favor, piense en ingreso total de su hogar en un mes promedio, considerando el aporte de todos sus miembros y otros ingresos adicionales como rentas de propiedades, jubilaciones o pensiones. ¿en cuál de estos tramos está el ingreso total mensual de su hogar?""}","{""Q0"":"" 1.663.000 – 2.899.000""}"
