"success","procedure","trial_type","trial_index","time_elapsed","internal_node_id","view_history","rt","trialid","stimulus","responses"
"true","AIM","fullscreen","16","75748","0.0-16.0-0.0","","","","",""
"","AIM","instructions","17","79070","0.0-17.0","[{""page_index"":0,""viewing_time"":3319}]","3320","Instructions","",""
"","AIM","survey-multi-choice-vertical","18","113409","0.0-18.0","","34318","AIM_01","{""Q0"":""¿Cuál es el nivel educacional alcanzado (último año aprobado) por el principal sostenedor del hogar?""}","{""Q0"":"" Instituto técnico (CFT) o instituto profesional completo (carreras de 1 a 3 años); hasta suboficial de FFAA y Carabineros.""}"
"","AIM","survey-multi-choice-vertical","19","146537","0.0-19.0","","33110","AIM_02","{""Q0"":""¿Cuál de las siguientes ocupaciones corresponde al trabajo del principal sostenedor del hogar? [Si el principal sostenedor del hogar está cesante o es jubilado, debe ser la última ocupación remunerada que tuvo. Si el principal sostenedor tiene más de 1 trabajo, debe registrarse el de mayor ingreso.]""}","{""Q0"":"" Profesionales, científicos e intelectuales.""}"
"","AIM","survey-text","20","154312","0.0-20.0","","7765","AIM_03","{""Q0"":""Ahora, hablando de su hogar: Incluyéndose usted, ¿cuántas personas viven en su hogar en la actualidad? No considere el servicio doméstico, aunque sea puertas adentro.""}","{""Q0"":""4""}"
"","AIM","survey-multi-choice-vertical","21","164116","0.0-24.0-0.0","","9787","AIM_07","{""Q0"":""Por favor, piense en ingreso total de su hogar en un mes promedio, considerando el aporte de todos sus miembros y otros ingresos adicionales como rentas de propiedades, jubilaciones o pensiones. ¿en cuál de estos tramos está el ingreso total mensual de su hogar?""}","{""Q0"":"" 1.663.000 – 2.899.000""}"
