"view_history","rt","trialid","procedure","trial_type","trial_index","time_elapsed","internal_node_id","stimulus","responses"
"[{""page_index"":0,""viewing_time"":1803}]","1803","Instructions","AIM","instructions","14","60413","0.0-16.0","",""
"","14373","AIM_01","AIM","survey-multi-choice-vertical","15","74796","0.0-17.0","{""Q0"":""¿Cuál es el nivel educacional alcanzado (último año aprobado) por el principal sostenedor del hogar?""}","{""Q0"":"" Postgrado (postítulo, master, magíster, doctor).""}"
"","10144","AIM_02","AIM","survey-multi-choice-vertical","16","84947","0.0-18.0","{""Q0"":""¿Cuál de las siguientes ocupaciones corresponde al trabajo del principal sostenedor del hogar? [Si el principal sostenedor del hogar está cesante o es jubilado, debe ser la última ocupación remunerada que tuvo. Si el principal sostenedor tiene más de 1 trabajo, debe registrarse el de mayor ingreso.]""}","{""Q0"":"" Profesionales, científicos e intelectuales.""}"
"","8764","AIM_03","AIM","survey-text","17","93719","0.0-19.0","{""Q0"":""Ahora, hablando de su hogar: Incluyéndose usted, ¿cuántas personas viven en su hogar en la actualidad? No considere el servicio doméstico, aunque sea puertas adentro.""}","{""Q0"":""3""}"
"","7177","AIM_06","AIM","survey-multi-choice-vertical","18","100904","0.0-22.0-0.0","{""Q0"":""Por favor, piense en ingreso total de su hogar en un mes promedio, considerando el aporte de todos sus miembros y otros ingresos adicionales como rentas de propiedades, jubilaciones o pensiones. ¿en cuál de estos tramos está el ingreso total mensual de su hogar?""}","{""Q0"":"" Más de 4.135.000""}"
