"success","procedure","trial_type","trial_index","time_elapsed","internal_node_id","view_history","rt","trialid","stimulus","responses"
"true","AIM","fullscreen","16","81259","0.0-16.0-0.0","","","","",""
"","AIM","instructions","17","85237","0.0-17.0","[{""page_index"":0,""viewing_time"":3975}]","3975","Instructions","",""
"","AIM","survey-multi-choice-vertical","18","102644","0.0-18.0","","17391","AIM_01","{""Q0"":""¿Cuál es el nivel educacional alcanzado (último año aprobado) por el principal sostenedor del hogar?""}","{""Q0"":"" Universitaria completa (carreras de 4 o más años); oficial de FFAA y Carabineros.""}"
"","AIM","survey-multi-choice-vertical","19","138847","0.0-19.0","","36190","AIM_02","{""Q0"":""¿Cuál de las siguientes ocupaciones corresponde al trabajo del principal sostenedor del hogar? [Si el principal sostenedor del hogar está cesante o es jubilado, debe ser la última ocupación remunerada que tuvo. Si el principal sostenedor tiene más de 1 trabajo, debe registrarse el de mayor ingreso.]""}","{""Q0"":"" Agricultores y trabajadores calificados agropecuarios y pesqueros.""}"
"","AIM","survey-text","20","154795","0.0-20.0","","15927","AIM_03","{""Q0"":""Ahora, hablando de su hogar: Incluyéndose usted, ¿cuántas personas viven en su hogar en la actualidad? No considere el servicio doméstico, aunque sea puertas adentro.""}","{""Q0"":""3""}"
"","AIM","survey-multi-choice-vertical","21","176761","0.0-23.0-0.0","","21955","AIM_06","{""Q0"":""Por favor, piense en ingreso total de su hogar en un mes promedio, considerando el aporte de todos sus miembros y otros ingresos adicionales como rentas de propiedades, jubilaciones o pensiones. ¿en cuál de estos tramos está el ingreso total mensual de su hogar?""}","{""Q0"":"" 780 mil – 1.359.000""}"
